{
  "$schema": "../schema/exclusion.schema.json",
  "id": "gcloud-credentials",
  "group": "cloudContainers",
  "paths": [
    "~/.config/gcloud/credentials.db",
    "~/.config/gcloud/access_tokens.db",
    "~/.config/gcloud/application_default_credentials.json",
    "~/.config/gcloud/legacy_credentials"
  ],
  "reason": {
    "en": "credentials",
    "nb": "påloggingsinformasjon"
  }
}
