{
  "$schema": "../schema/exclusion.schema.json",
  "id": "vscode-settings",
  "group": "editorSettings",
  "paths": [
    "~/Library/Application Support/Code/User/settings.json",
    "~/Library/Application Support/Code/User/keybindings.json",
    "~/Library/Application Support/Code/User/snippets"
  ],
  "reason": {
    "en": "user settings",
    "nb": "brukerinnstillinger"
  }
}
